### ISSUE TITLE
Improve re-connect handling

### ISSUE THREAD

**Issue by kenkendk** [duplicati/ngclient#283]
If the token expires, the websocket can fail to authenticate, which causes connections to be lost.
Only solution seems to be to reload the page.

**Comment by ts678** [comment]
Initial analysis gives some clue as to the websocket disconnect, but I think it should be handled regardless:

```
Produced by netstat -ano | findstr :8100 (8100 is the 2.1.1.100 server port)

PID 74182 is Duplicati.GUI.TrayIcon.exe
PID 66980 is Microsoft Edge

Header line is
  Proto  Local Address          Foreign Address        State           PID

and I'm deleting LISTENING lines to only show ESTABLISHED (until time comes for more)

While Duplicati is trying to get a websocket connection using an invalid access token
  TCP    127.0.0.1:8100         127.0.0.1:62157        ESTABLISHED     74812
  TCP    127.0.0.1:62157        127.0.0.1:8100         ESTABLISHED     74812

After browser refresh, there are four new connections established from Microsoft Edge
  TCP    127.0.0.1:8100         127.0.0.1:58932        ESTABLISHED     74812
  TCP    127.0.0.1:8100         127.0.0.1:58933        ESTABLISHED     74812
  TCP    127.0.0.1:8100         127.0.0.1:58937        ESTABLISHED     74812
  TCP    127.0.0.1:8100         127.0.0.1:58938        ESTABLISHED     74812
  TCP    127.0.0.1:8100         127.0.0.1:62157        ESTABLISHED     74812
  TCP    127.0.0.1:58932        127.0.0.1:8100         ESTABLISHED     66980
  TCP    127.0.0.1:58933        127.0.0.1:8100         ESTABLISHED     66980
  TCP    127.0.0.1:58937        127.0.0.1:8100         ESTABLISHED     66980
  TCP    127.0.0.1:58938        127.0.0.1:8100         ESTABLISHED     66980
  TCP    127.0.0.1:62157        127.0.0.1:8100         ESTABLISHED     74812

After short PC sleep and wake, no past Edge connections remain, but there's a new one
  TCP    127.0.0.1:8100         127.0.0.1:50155        ESTABLISHED     74812
  TCP    127.0.0.1:8100         127.0.0.1:62157        ESTABLISHED     74812
  TCP    127.0.0.1:50155        127.0.0.1:8100         ESTABLISHED     66980
  TCP    127.0.0.1:62157        127.0.0.1:8100         ESTABLISHED     74812

Looking at the TCP state of the former Edge connections, they got closed by Edge side
  TCP    127.0.0.1:58932        127.0.0.1:8100         TIME_WAIT       0
  TCP    127.0.0.1:58933        127.0.0.1:8100         TIME_WAIT       0
  TCP    127.0.0.1:58937        127.0.0.1:8100         TIME_WAIT       0
  TCP    127.0.0.1:58938        127.0.0.1:8100         TIME_WAIT       0
```

```
This Wireshark test actually came earlier but gets more technical.
This came from an actual evening PC sleep which began at 21:26:31,
according to powercfg /sleepstudy, after checking it next morning.
Except for TrayIcon longpoll, other connections close from client.

Here is a flurry of TCP close, all initiated from the client side:
No.     Time                            Protocol        Info
118     2025-08-11 21:26:08.653518      TCP             49352 → 8100 [FIN, ACK] Seq=1299 Ack=3927 Win=2615808 Len=0
119     2025-08-11 21:26:08.653542      TCP             8100 → 49352 [ACK] Seq=3927 Ack=1300 Win=2618880 Len=0
120     2025-08-11 21:26:08.653710      TCP             49351 → 8100 [FIN, ACK] Seq=2774 Ack=10860 Win=2608896 Len=0
121     2025-08-11 21:26:08.653726      TCP             8100 → 49351 [ACK] Seq=10860 Ack=2775 Win=2617856 Len=0
122     2025-08-11 21:26:08.653760      TCP             49350 → 8100 [FIN, ACK] Seq=936 Ack=5709 Win=2614016 Len=0
123     2025-08-11 21:26:08.653775      TCP             8100 → 49350 [ACK] Seq=5709 Ack=937 Win=2619648 Len=0
124     2025-08-11 21:26:08.653811      TCP             49346 → 8100 [FIN, ACK] Seq=7891 Ack=314142 Win=2619392 Len=0
125     2025-08-11 21:26:08.653825      TCP             8100 → 49346 [ACK] Seq=314142 Ack=7892 Win=2612224 Len=0
126     2025-08-11 21:26:08.657901      TCP             8100 → 49352 [FIN, ACK] Seq=3927 Ack=1300 Win=2618880 Len=0
127     2025-08-11 21:26:08.657940      TCP             49352 → 8100 [ACK] Seq=1300 Ack=3928 Win=2615808 Len=0
128     2025-08-11 21:26:08.658014      TCP             8100 → 49351 [FIN, ACK] Seq=10860 Ack=2775 Win=2617856 Len=0
129     2025-08-11 21:26:08.658036      TCP             49351 → 8100 [ACK] Seq=2775 Ack=10861 Win=2608896 Len=0
130     2025-08-11 21:26:08.658176      TCP             8100 → 49350 [FIN, ACK] Seq=5709 Ack=937 Win=2619648 Len=0
131     2025-08-11 21:26:08.658197      TCP             49350 → 8100 [ACK] Seq=937 Ack=5710 Win=2614016 Len=0
132     2025-08-11 21:26:08.658244      TCP             8100 → 49346 [FIN, ACK] Seq=314142 Ack=7892 Win=2612224 Len=0
133     2025-08-11 21:26:08.658265      TCP             49346 → 8100 [ACK] Seq=7892 Ack=314143 Win=2619392 Len=0

Above the mass closings, one can see that 49352 was the websocket:
No.     Time                            Protocol        Info
116     2025-08-11 21:26:03.298495      WebSocket       WebSocket Pong [FIN] 
117     2025-08-11 21:26:03.298528      TCP             49352 → 8100 [ACK] Seq=1299 Ack=3927 Win=2615808 Len=0

After the mass closings, port 62157 continues until system sleeps:
No.     Time                            Protocol        Info
134     2025-08-11 21:26:11.374146      HTTP/JSON       HTTP/1.1 200 OK , JSON (application/json)
135     2025-08-11 21:26:11.374185      TCP             62157 → 8100 [ACK] Seq=1 Ack=596 Win=10179 Len=0
136     2025-08-11 21:26:11.375203      HTTP            GET /api/v1/serversettings HTTP/1.1 
137     2025-08-11 21:26:11.375229      TCP             8100 → 62157 [ACK] Seq=596 Ack=407 Win=10144 Len=0
138     2025-08-11 21:26:11.376124      HTTP/JSON       HTTP/1.1 200 OK , JSON (application/json)
139     2025-08-11 21:26:11.376142      TCP             62157 → 8100 [ACK] Seq=407 Ack=1621 Win=10175 Len=0
140     2025-08-11 21:26:11.376257      HTTP            GET /api/v1/serverstate?longpoll=true&lastEventId=284&duration=5m HTTP/1.1 
141     2025-08-11 21:26:11.376273      TCP             8100 → 62157 [ACK] Seq=1621 Ack=852 Win=10142 Len=0
142     2025-08-11 21:26:11.376505      HTTP/JSON       HTTP/1.1 200 OK , JSON (application/json)
143     2025-08-11 21:26:11.376520      TCP             62157 → 8100 [ACK] Seq=852 Ack=2216 Win=10173 Len=0
144     2025-08-11 21:26:11.376614      HTTP            GET /api/v1/serverstate?longpoll=true&lastEventId=285&duration=5m HTTP/1.1 
145     2025-08-11 21:26:11.376628      TCP             8100 → 62157 [ACK] Seq=2216 Ack=1297 Win=10141 Len=0

After system woke for Windows Update, poll continued on same port.
You can also see 62157 still in use on the netstat testing report.
```

**Comment by ts678** [comment]
> If the token expires, the websocket can fail to authenticate

Because I'm tired of constant failures overnight (even in Chrome) I tried [below](https://forum.duplicati.com/t/release-2-1-0-119-canary-2025-05-29/20715#p-77809-disabling-reported-options-on-webserver-9), which has had a few forum mentions.

`--webservice-disable-api-extensions so websocket usage can be disabled`

More specifically, TrayIcon has `--webservice-disable-api-extensions=v1:websocket` as was mentioned in forum [here](https://forum.duplicati.com/t/disable-password-on-gui/19638/35?u=ts678):

```
You can try to disable the websocket by starting Duplicati with:

--webservice-disable-api-extensions=v1:websocket

This will instruct ngclient to fall back to the polling method
```

It still doesn't connect backup without manual refresh, but at least my profiling log stays quiet. No token complaints.

<img width="926" height="191" alt="Image" src="https://github.com/user-attachments/assets/21955b36-1eaa-4ed1-898e-619d78e8522f" />

ngclient is doing its countdown (is this shorter than usual?) from 5 to 1 and then back to 5, displaying this in window:

<img width="448" height="160" alt="Image" src="https://github.com/user-attachments/assets/89dca98f-9976-4712-a272-1dca8cb8d22a" />

2.2.0.1_stable_2025-11-09
